id,name,level,description,guideline_id,help_url,axe_rules
1.1.1,Non-text Content,A,"All non-text content that is presented to the user has a text alternative that serves the equivalent purpose.",1.1,https://www.w3.org/WAI/WCAG21/Understanding/non-text-content.html,image-alt|input-image-alt|object-alt
1.2.1,Audio-only and Video-only (Prerecorded),A,"For prerecorded audio-only and prerecorded video-only media an alternative is provided.",1.2,https://www.w3.org/WAI/WCAG21/Understanding/audio-only-and-video-only-prerecorded.html,
1.3.1,Info and Relationships,A,"Information structure and relationships conveyed through presentation can be programmatically determined.",1.3,https://www.w3.org/WAI/WCAG21/Understanding/info-and-relationships.html,definition-list|dlitem|list|listitem
1.4.3,Contrast (Minimum),AA,"The visual presentation of text and images of text has a contrast ratio of at least 4.5:1.",1.4,https://www.w3.org/WAI/WCAG21/Understanding/contrast-minimum.html,color-contrast
2.1.1,Keyboard,A,"All functionality of the content is operable through a keyboard interface.",2.1,https://www.w3.org/WAI/WCAG21/Understanding/keyboard.html,keyboard-trap
